{
  "architecture": {
    "gdn_geometry": {
      "conv_channels": 3,
      "conv_kernel": 3,
      "state_size": 2,
      "value_heads": 2
    },
    "gdn_layers": [
      0,
      2
    ],
    "layer_count": 3,
    "model_family": "synthetic-three-layer-contract-model",
    "mtp_geometry": {
      "head_dim": 4,
      "kv_heads": 1,
      "page_size_cells": 2,
      "ring_capacity_cells": 2
    },
    "ple_geometry": {
      "history_channels": 3,
      "history_rows": 2,
      "previous_token_count": 2
    },
    "qsa_geometry": {
      "head_dim": 4,
      "idx_block": 2,
      "idx_dim": 4,
      "kv_heads": 1,
      "page_size_cells": 2
    },
    "qsa_layers": [
      1
    ]
  },
  "contract_version": 3,
  "evidence_class": "synthetic_contract_only",
  "mode": "abcd_on",
  "provenance": {
    "binary_sha256": "3c59e26726a9083db93c94324ef22d5ed9e70dfaf04de3c7494bd68673a81b48",
    "command_sha256": "3c59e26726a9083db93c94324ef22d5ed9e70dfaf04de3c7494bd68673a81b48",
    "device_and_runtime": "synthetic fixture; no device accessed",
    "model_sha256": "3c59e26726a9083db93c94324ef22d5ed9e70dfaf04de3c7494bd68673a81b48",
    "mtp_sha256": "3c59e26726a9083db93c94324ef22d5ed9e70dfaf04de3c7494bd68673a81b48",
    "source_commit": "synthetic-fixture-only",
    "synthetic": true,
    "tokenizer_sha256": "3c59e26726a9083db93c94324ef22d5ed9e70dfaf04de3c7494bd68673a81b48",
    "trace_capture_method": "synthetic labels; no runtime capture"
  },
  "requests": [
    {
      "cache_fresh_tokens": 2,
      "cache_key_sha256": "3c59e26726a9083db93c94324ef22d5ed9e70dfaf04de3c7494bd68673a81b48",
      "cache_reused_tokens": 2,
      "commits": [
        {
          "capture_point": {
            "after_verifier_commit": true,
            "copy_completion_synchronized": true,
            "mtp_draft_stream_synchronized": true,
            "mutating_streams_synchronized": true
          },
          "commit_index": 0,
          "committed_tokens": [
            {
              "position": 4,
              "token_id": 201
            },
            {
              "position": 5,
              "token_id": 202
            }
          ],
          "components": [
            {
              "byte_length": 32,
              "byte_order": "little",
              "canonical_serialization": "strata_component_payload_v1",
              "component_id": "gdn_recurrence@0",
              "dtype": "fp32",
              "format_metadata": {
                "position_end_exclusive": 6
              },
              "kind": "gdn_recurrence",
              "layer_index": 0,
              "layout": "key_width,value_head,key_width",
              "sha256": "2f941966ea16deb3421856383cca1a5ca96dca57f72281fc94e3fadc030c9689",
              "shape": [
                2,
                2,
                2
              ]
            },
            {
              "byte_length": 24,
              "byte_order": "little",
              "canonical_serialization": "strata_component_payload_v1",
              "component_id": "gdn_conv_history@0",
              "dtype": "fp32",
              "format_metadata": {
                "position_end_exclusive": 6
              },
              "kind": "gdn_conv_history",
              "layer_index": 0,
              "layout": "channel,history_oldest_first",
              "sha256": "824221ec921b60237e4f91606fd00571869e4d991f64b14da26cd3eddc84a818",
              "shape": [
                3,
                2
              ]
            },
            {
              "byte_length": 48,
              "byte_order": "little",
              "canonical_serialization": "strata_component_payload_v1",
              "component_id": "qsa_kv_key@1",
              "dtype": "fp16",
              "format_metadata": {
                "key_rotation": "none",
                "kv_format": "fp16",
                "kv_mode": "resident",
                "kv_role": "key",
                "logical_live_position_end_exclusive": 6,
                "logical_live_position_start": 0,
                "page_size_cells": 2,
                "payload_segments": [
                  {
                    "byte_length": 48,
                    "logical_order": "logical_position,kv_head,head_dim",
                    "name": "values_fp16_le",
                    "offset_bytes": 0
                  }
                ],
                "value_rotation": "none"
              },
              "kind": "qsa_kv_key",
              "layer_index": 1,
              "layout": "logical_position,kv_head,head_dim",
              "sha256": "1ff82004e0f1c30d6af40b41d23e4fb30410384c7f12495b20c02b1cb56ae71a",
              "shape": [
                6,
                1,
                4
              ]
            },
            {
              "byte_length": 48,
              "byte_order": "little",
              "canonical_serialization": "strata_component_payload_v1",
              "component_id": "qsa_kv_value@1",
              "dtype": "fp16",
              "format_metadata": {
                "key_rotation": "none",
                "kv_format": "fp16",
                "kv_mode": "resident",
                "kv_role": "value",
                "logical_live_position_end_exclusive": 6,
                "logical_live_position_start": 0,
                "page_size_cells": 2,
                "payload_segments": [
                  {
                    "byte_length": 48,
                    "logical_order": "logical_position,kv_head,head_dim",
                    "name": "values_fp16_le",
                    "offset_bytes": 0
                  }
                ],
                "value_rotation": "none"
              },
              "kind": "qsa_kv_value",
              "layer_index": 1,
              "layout": "logical_position,kv_head,head_dim",
              "sha256": "a46f60c409bfb299e3c725e37476663d9b4594dd6af1a846398d227efdf53ed1",
              "shape": [
                6,
                1,
                4
              ]
            },
            {
              "byte_length": 16,
              "byte_order": "little",
              "canonical_serialization": "strata_component_payload_v1",
              "component_id": "qsa_idx_tail@1",
              "dtype": "fp32",
              "format_metadata": {
                "idx_block": 2,
                "idx_dim": 4,
                "idx_pooled_rows": 4,
                "position_end_exclusive": 6
              },
              "kind": "qsa_idx_tail",
              "layer_index": 1,
              "layout": "tail_position,idx_dimension",
              "sha256": "4e8b39bfaad98293f28cedab5605a6eb24b5dba79043a016626d1b0a7cf81124",
              "shape": [
                1,
                4
              ]
            },
            {
              "byte_length": 16,
              "byte_order": "little",
              "canonical_serialization": "strata_component_payload_v1",
              "component_id": "qsa_idx_dead@1",
              "dtype": "fp32",
              "format_metadata": {
                "idx_block": 2,
                "idx_dim": 4,
                "idx_pooled_rows": 4,
                "position_end_exclusive": 6
              },
              "kind": "qsa_idx_dead",
              "layer_index": 1,
              "layout": "dead_key_dimension",
              "sha256": "1e975cedc344a6bb27b06c895b914e7545f924d198e909bbf7385c7f8701770c",
              "shape": [
                4
              ]
            },
            {
              "byte_length": 64,
              "byte_order": "little",
              "canonical_serialization": "strata_component_payload_v1",
              "component_id": "qsa_idx_pooled@1",
              "dtype": "fp32",
              "format_metadata": {
                "idx_block": 2,
                "idx_dim": 4,
                "idx_pooled_rows": 4,
                "position_end_exclusive": 6
              },
              "kind": "qsa_idx_pooled",
              "layer_index": 1,
              "layout": "logical_pooled_row,idx_dimension",
              "sha256": "d60083f721175cf6dd5e723137f1b9c6cc4701f1902140a1d9216bfc1f394ebd",
              "shape": [
                4,
                4
              ]
            },
            {
              "byte_length": 4,
              "byte_order": "little",
              "canonical_serialization": "strata_component_payload_v1",
              "component_id": "qsa_idx_block_pos@1",
              "dtype": "int32",
              "format_metadata": {
                "idx_block": 2,
                "idx_block_pos_value": 5,
                "idx_dim": 4,
                "idx_pooled_rows": 4,
                "position_end_exclusive": 6
              },
              "kind": "qsa_idx_block_pos",
              "layer_index": 1,
              "layout": "scalar",
              "sha256": "de1055a0b48b92d8c689e009103d5ef201e954899107813cef51ae5baa230532",
              "shape": [
                1
              ]
            },
            {
              "byte_length": 32,
              "byte_order": "little",
              "canonical_serialization": "strata_component_payload_v1",
              "component_id": "gdn_recurrence@2",
              "dtype": "fp32",
              "format_metadata": {
                "position_end_exclusive": 6
              },
              "kind": "gdn_recurrence",
              "layer_index": 2,
              "layout": "key_width,value_head,key_width",
              "sha256": "21efa35161b59e859bb93ef1d8dbd372ea3c802d753b3ea5608ecf3031fb5ce5",
              "shape": [
                2,
                2,
                2
              ]
            },
            {
              "byte_length": 24,
              "byte_order": "little",
              "canonical_serialization": "strata_component_payload_v1",
              "component_id": "gdn_conv_history@2",
              "dtype": "fp32",
              "format_metadata": {
                "position_end_exclusive": 6
              },